안지훈	경상북도 오산시 양재천548길	81067	(유) 이	기타 판매 및 고객 서비스 관리자	070-9714-9357	sanghun82@example.org	jieun51	192.168.231.45	51.68.240.158	총 실시간 암호화	SandyBrown
하영환	부산광역시 강북구 영동대거리 (수진곽마을)	81868	(주) 김	승강기 설치 및 정비원	019-162-5675	hi@example.org	qmun	172.16.247.33	11.209.158.42	멀티 레이어 하이브리드 GUI	SeaShell
김경숙	경상북도 화천군 영동대414길 (옥자이리)	23420	(주) 곽손강	계기 검침원 및 가스점검원	051-599-9484	junhyeog69@example.org	yi	172.29.162.111	187.53.13.27	동기화 실행 축적	IndianRed
김예은	울산광역시 강북구 선릉거리	82050	유한회사 양김김	기타 종교관련 종사자	042-900-4596	gojiyeon@example.org	minseo18	10.190.166.200	166.59.252.91	수익에 중점을 둔 결합된 연합	Sienna
이상호	제주특별자치도 제천시 반포대463로 (민준안마을)	67291	김김	일반기계 조립원	016-856-2441	donghyeoni@example.com	gi	192.168.52.211	206.17.236.103	미래가 보장된 장거리 지원	DimGray
박민재	경상북도 동두천시 서초대로	81445	민강김	오락시설 서비스원	043-573-1235	eunjicoe@example.org	cbag	172.23.43.205	195.85.167.220	출판된 글로벌 암호화	MediumSeaGreen
김광수	부산광역시 마포구 가락2거리 (정웅박리)	95673	(주) 오박이	광고 및 홍보 전문가	062-853-6643	gimyeongjin@example.org	ihyeonu	192.168.84.63	69.183.138.217	크로스 그룹 백그라운드 코어	YellowGreen
이아름	충청남도 화성시 테헤란04가	50343	유한회사 송김남	장례 상담원 및 장례 지도사	031-463-0224	coeboram@example.org	jaeho41	10.117.135.15	164.125.105.129	변경 가능한 고단계 설치과정	DarkTurquoise
한은정	세종특별자치시 동구 강남대5가 (정숙김김동)	89088	김김최	화물열차 차장 및 관련 종사원	043-911-8459	ggim@example.com	vmin	172.29.246.206	121.177.211.145	더 작아진 백그라운드 고객 만족	GreenYellow
김미숙	인천광역시 성동구 봉은사7거리 (영희이서마을)	81291	이김이	기타 음식서비스 종사원	063-778-4221	gweonjunho@example.net	jeongsun32	192.168.252.76	76.0.220.102	복제된 24시간 환경	Cornsilk
이하은	전라남도 부천시 오정구 학동거리	35703	(유) 손오안	장례 상담원 및 장례 지도사	033-010-5100	junyeonggim@example.net	mgim	10.10.246.73	218.49.190.38	더 작아진 5세대 예산 관리	LimeGreen
박영일	대구광역시 서초구 개포거리	55477	양조	기타 비금속제품관련 생산기 조작원	061-140-7815	jihun96@example.net	iyeongsig	10.166.145.73	168.228.134.55	강화된 멀티 태스킹 생산 능력	AntiqueWhite
박현우	부산광역시 성북구 백제고분로	74019	김이민	곡물가공제품 기계 조작원	053-216-2785	caeweon05@example.org	jeongung97	192.168.143.231	162.66.44.184	자가 이용 가능한 인간자원 어댑터	Orange
김동현	강원도 광주시 반포대로	31919	유한회사 이	기계공학 기술자 및 연구원	062-346-5785	mgim@example.net	jeonghyi24	10.174.40.136	47.57.121.116	진보적인 교훈적 지식 기반	Yellow
문예진	대구광역시 서초구 서초중앙가 (정호김김리)	44805	(주) 김	금융관련 사무원	011-920-7170	gimboram@example.org	qcoe	10.68.23.23	67.123.76.3	강력한 무해한 배열	SlateBlue
김영일	부산광역시 구로구 강남대거리	54116	김허	식품공학 기술자 및 연구원	010-3360-6628	igim@example.net	ngim	192.168.45.4	221.66.86.43	비즈니스 중점적 환경 친화적 예보	PaleTurquoise
오민지	충청북도 논산시 언주길 (정호이오마을)	56157	주식회사 김이박	기타 사육관련 종사원	018-387-6524	cunjai@example.net	jeonghyi89	10.76.165.130	140.151.132.23	프로그래밍 가능한 고도 기반 융합	SlateBlue
김성훈	부산광역시 마포구 삼성82거리 (정호강이마을)	91052	(주) 김	자동조립라인 및 산업용 로봇 조작원	017-296-7175	minjaegim@example.com	yeonghyi39	172.29.241.169	221.187.134.209	조절 가능한 고단계 아키텍쳐	LemonChiffon
류진호	세종특별자치시 북구 서초대길	83926	(주) 김	전기/전자 및 기계 공학 시험원	011-085-2999	hyeonjibag@example.net	iseojun	10.46.252.98	164.39.133.9	융합된 보조 안내 창구	SeaShell
박지후	부산광역시 송파구 압구정로	90650	고장김	변호사	052-498-4576	hyeonui@example.com	jieun54	10.120.156.85	194.9.54.116	안전한 휴리스틱 에뮬레이션	SlateGray
이재현	인천광역시 동작구 석촌호수7로 (시우홍장리)	48516	주식회사 하	이용사	070-5208-7985	phong@example.com	ujo	10.179.175.36	38.199.199.229	다양한 글로벌 예보	DarkTurquoise
김영수	대구광역시 도봉구 양재천가	04252	(주) 김윤김	기타 자동차 운전원	062-445-1460	yeonggilgim@example.org	eunju83	172.18.169.31	204.43.62.58	중심이 결정 안내 창구	Linen
배현정	강원도 수원시 역삼919길	87819	김오	금융관련 사무원	064-755-0169	jinho52@example.com	fbag	172.26.63.172	137.198.146.14	조절 가능한 무관리 공개 시스템	Khaki
이성호	서울특별시 남구 테헤란길 (미경이읍)	31962	유한회사 안	주방 보조원	043-619-8657	gimmyeongsug@example.net	ogim	172.27.180.5	149.22.174.24	복제된 최대화 어플리케이션	Purple
이우진	울산광역시 송파구 논현91로	23180	주식회사 박김김	기타 사육관련 종사원	011-353-4753	seonghunbag@example.org	sumin47	192.168.168.171	219.201.102.195	비전 있는 하이브리드 융합	Chartreuse
김미정	부산광역시 성북구 삼성로 (성호이읍)	31791	(주) 장한김	통신/방송 및 인터넷 케이블 설치 및 수리원	051-919-2253	gangjinu@example.com	bagsumin	192.168.201.158	2.37.72.43	더 커진 비대칭 엔진	MediumPurple
홍민재	제주특별자치도 청주시 서원구 백제고분가	59684	(유) 김	기타 건설관련 기능 종사원	070-2715-3278	ijeongnam@example.com	zgim	172.29.179.177	143.147.144.233	비즈니스 중점적 헌신적 펌웨어	Crimson
장영호	광주광역시 구로구 압구정30가 (영수주백마을)	98234	유한회사 김	자산 운용가	054-133-1010	gimgeonu@example.org	yo	192.168.150.38	216.158.159.122	리버스 엔지니어링된 근본적 그래픽 인터페이스	LimeGreen
박지후	경기도 수원시 영통구 서초중앙가 (우진김읍)	89228	김구	학습지 및 방문 교사	063-219-1141	bryu@example.net	jiyeoncoe	172.20.51.201	55.24.161.103	인체 공학적인 지역적 데이터베이스	DarkTurquoise
김정순	경상남도 양평군 테헤란7거리 (아름김손마을)	34076	(유) 김김이	법률/경찰/소방 및 교도 관리자